{
  "schemaVersion": "2.1-factual",
  "scope": {
    "type": "single_conversation"
  },
  "source": {
    "host": "git.example.com",
    "owner": "example-org",
    "prNumber": 987,
    "repo": "example-repo",
    "scrapedAt": "2026-03-23T19:40:12.000Z",
    "title": "#987 - Improve notification listener - example-repo - Git",
    "url": "https://git.example.com/example-org/example-repo/pulls/987"
  },
  "actors": {
    "currentUser": {
      "username": "author_b"
    },
    "prAuthor": {
      "username": null
    }
  },
  "identityResolution": {
    "currentUserKnown": true,
    "prAuthorKnown": false
  },
  "conversations": [
    {
      "conversationId": "123456",
      "nodeType": "change",
      "filePath": "backend/service/src/main/java/com/example/app/NotificationService.java",
      "threadUrl": "https://git.example.com/example-org/example-repo/pulls/987/files#issuecomment-123456",
      "resolved": false,
      "outdated": false,
      "selectionReason": "included_by_default",
      "lineNew": 87,
      "lineOld": null,
      "diffSide": "new",
      "hunkHeader": "@@ -80,4 +87,9 @@ public class NotificationService {",
      "rootComment": {
        "author": "reviewer_a",
        "datetime": "2026-03-22T12:14:51.000Z",
        "id": "123456",
        "text": "Can this duplicate guard be moved into a shared method?"
      },
      "comments": [
        {
          "author": "author_b",
          "datetime": "2026-03-22T13:04:10.000Z",
          "id": "123499",
          "text": "Yes, moved to NotificationUtils and updated call sites."
        }
      ],
      "commentCount": 2,
      "hasReplies": true,
      "lastCommentId": "123499",
      "lastCommentAuthor": "author_b",
      "lastCommentAuthorIsCurrentUser": true,
      "lastCommentAuthorIsPrAuthor": null,
      "lastCommentAt": "2026-03-22T13:04:10.000Z",
      "lastCommentUrl": "https://git.example.com/example-org/example-repo/pulls/987/files#issuecomment-123499",
      "lastCommentByOtherUser": false
    }
  ],
  "exportFingerprint": "fnv1a:3f249aa1"
}
